{"index": 300, "width": 921, "height": 1086, "dpi": 144.0, "blocks": [{"block_id": 0, "box": [516.2, 511.7, 665.2, 657.0], "label": "seal", "score": null, "order": 0, "content": null, "kind": "none", "source_category": "Stamp"}], "raw": null, "meta": {"case": "6ab94aaf", "book": "annopage", "file": "6ab94aaf-aa7f-4570-b9ad-429bdea4856c.jpg", "objects_out_of_scope": {"doubtful": 1, "inexpressible": 1}, "out_of_scope": [{"box": [667.4, 52.8, 747.0, 156.2], "category": "Handwritten note", "bucket": "disputed"}, {"box": [240.3, 559.8, 461.7, 802.0], "category": "Signet", "bucket": "inexpressible"}], "text_marked": false, "order_marked": false, "downscale": 0.3557}}