{"index": 12, "width": 1012, "height": 1466, "dpi": 144.0, "blocks": [{"block_id": 0, "box": [71.7, 75.9, 937.2, 144.1], "label": "text", "score": null, "order": 0, "content": "The lead screw must be lowered to obtain a correct alignment with the half nuts. In addition, the lead screw must be aligned to the bed ways. To test this alignment the lead screw is inserted in the bearings and the carriage is placed at the mid-point on the bed ways, closing the half nuts on the lead screw. A simple indicating jig is then made up. The lead screw must be lowered to obtain a correct alignment with the half nuts. In addition, the lead screw must be aligned to the bed ways. To test this alig", "kind": "text"}, {"block_id": 1, "box": [70.6, 159.8, 946.4, 256.2], "label": "text", "score": null, "order": 1, "content": "The lead screw must be lowered to obtain a correct alignment with the half nuts. In addition, the lead screw must be aligned to the bed ways. To test this alignment the lead screw is inserted in the bearings and the carriage is placed at the mid-point on the bed ways, closing the half nuts on the lead screw. A simple indicating jig is then made up. The lead screw must be lowered to obtain a correct alignment with the half nuts. In addition, the lead screw must be aligned to the bed ways. To test this alignment the lead screw is inserted in the bearings and the carriage is placed at the mid-point on the bed ways, closing the half nuts on the lead screw. A simple indicating jig is then made up.", "kind": "text"}, {"block_id": 2, "box": [69.2, 277.8, 948.3, 402.2], "label": "text", "score": null, "order": 2, "content": "The lead screw must be lowered to obtain a correct alignment with the half nuts. In addition, the lead screw must be aligned to the bed ways. To test this alignment the lead screw is inserted in the bearings and the carriage is placed at the mid-point on the bed ways, closing the half nuts on the lead screw. A simple indicating jig is then made up. The lead screw must be lowered to obtain a correct alignment with the half nuts. In addition, the lead screw must be aligned to the bed ways. To test this alignment the lead screw is inserted in the bearings and the carriage is placed at the mid-point on the bed ways, closing the half nuts on the lead screw. A simple indicating jig is then made up. The lead screw must be lowered to obtain a correct alignment with the half nuts. In addition, the lead screw must be aligned to the bed ways. To test this alignment the lead screw is inserted in the bearings and the carriage is placed at the mid", "kind": "text"}, {"block_id": 3, "box": [67.5, 429.8, 946.8, 582.2], "label": "text", "score": null, "order": 3, "content": "The lead screw must be lowered to obtain a correct alignment with the half nuts. In addition, the lead screw must be aligned to the bed ways. To test this alignment the lead screw is inserted in the bearings and the carriage is placed at the mid-point on the bed ways, closing the half nuts on the lead screw. A simple indicating jig is then made up. The lead screw must be lowered to obtain a correct alignment with the half nuts. In addition, the lead screw must be aligned to the bed ways. To test this alignment the lead screw is inserted in the bearings and the carriage is placed at the mid-point on the bed ways, closing the half nuts on the lead screw. A simple indicating jig is then made up. The lead screw must be lowered to obtain a correct alignment with the half nuts. In addition, the lead screw must be aligned to the bed ways. To test this alignment the lead screw is inserted in the bearings and the carriage is placed at the mid-point on the bed ways, closing the half nuts on the lead screw. A simple indicating jig is then made up. The lead screw must be lowered to obtain a correct alignment with the half nuts. In addition, the lead screw must be aligned to the bed ways. To test this alignment the lead screw is inserted in the bearings an", "kind": "text"}, {"block_id": 4, "box": [73.9, 643.9, 816.8, 1278.9], "label": "table", "score": null, "order": 4, "content": null, "kind": "none"}], "raw": null, "meta": {"case": "table_split_a", "book": "spravochnik", "aging": "old", "synth_seed": 742068257, "rotation": 0, "gutter": null, "ink_outside_truth": {"pixels": 0, "largest_blob": null}, "text_marked": true, "order_marked": true, "char_truth": {"chars": 3421, "words": 654, "blocks_with_text": 4, "text_blocks_without_chars": 0, "which_without_chars": [], "tables_with_grid": 1, "cell_count": 175}, "text_layer_check": {"words_in_layer": 1911, "missing_from_layer": 0, "outside_truth": 0, "ghosts": 737, "dot_leaders": 0, "unexplained": 0, "outside_truth_samples": [], "mismatch_examples": []}, "artifact_truth": {"4": {"rows": 35, "cols": 5, "cells": [["Col 1", "Col 2", "Col 3", "Col 4", "Col 5"], ["0 to .002\"", "0 to .003\"", "0 to .004\"", "0 to .005\"", "0 to .006\""], ["0 to .003\"", "0 to .004\"", "0 to .005\"", "0 to .006\"", "0 to .007\""], ["0 to .004\"", "0 to .005\"", "0 to .006\"", "0 to .007\"", "0 to .008\""], ["0 to .005\"", "0 to .006\"", "0 to .007\"", "0 to .008\"", "0 to .002\""], ["0 to .006\"", "0 to .007\"", "0 to .008\"", "0 to .002\"", "0 to .003\""], ["0 to .007\"", "0 to .008\"", "0 to .002\"", "0 to .003\"", "0 to .004\""], ["0 to .008\"", "0 to .002\"", "0 to .003\"", "0 to .004\"", "0 to .005\""], ["0 to .002\"", "0 to .003\"", "0 to .004\"", "0 to .005\"", "0 to .006\""], ["0 to .003\"", "0 to .004\"", "0 to .005\"", "0 to .006\"", "0 to .007\""], ["0 to .004\"", "0 to .005\"", "0 to .006\"", "0 to .007\"", "0 to .008\""], ["0 to .005\"", "0 to .006\"", "0 to .007\"", "0 to .008\"", "0 to .002\""], ["0 to .006\"", "0 to .007\"", "0 to .008\"", "0 to .002\"", "0 to .003\""], ["0 to .007\"", "0 to .008\"", "0 to .002\"", "0 to .003\"", "0 to .004\""], ["0 to .008\"", "0 to .002\"", "0 to .003\"", "0 to .004\"", "0 to .005\""], ["0 to .002\"", "0 to .003\"", "0 to .004\"", "0 to .005\"", "0 to .006\""], ["0 to .003\"", "0 to .004\"", "0 to .005\"", "0 to .006\"", "0 to .007\""], ["0 to .004\"", "0 to .005\"", "0 to .006\"", "0 to .007\"", "0 to .008\""], ["0 to .005\"", "0 to .006\"", "0 to .007\"", "0 to .008\"", "0 to .002\""], ["0 to .006\"", "0 to .007\"", "0 to .008\"", "0 to .002\"", "0 to .003\""], ["0 to .007\"", "0 to .008\"", "0 to .002\"", "0 to .003\"", "0 to .004\""], ["0 to .008\"", "0 to .002\"", "0 to .003\"", "0 to .004\"", "0 to .005\""], ["0 to .002\"", "0 to .003\"", "0 to .004\"", "0 to .005\"", "0 to .006\""], ["0 to .003\"", "0 to .004\"", "0 to .005\"", "0 to .006\"", "0 to .007\""], ["0 to .004\"", "0 to .005\"", "0 to .006\"", "0 to .007\"", "0 to .008\""], ["0 to .005\"", "0 to .006\"", "0 to .007\"", "0 to .008\"", "0 to .002\""], ["0 to .006\"", "0 to .007\"", "0 to .008\"", "0 to .002\"", "0 to .003\""], ["0 to .007\"", "0 to .008\"", "0 to .002\"", "0 to .003\"", "0 to .004\""], ["0 to .008\"", "0 to .002\"", "0 to .003\"", "0 to .004\"", "0 to .005\""], ["0 to .002\"", "0 to .003\"", "0 to .004\"", "0 to .005\"", "0 to .006\""], ["0 to .003\"", "0 to .004\"", "0 to .005\"", "0 to .006\"", "0 to .007\""], ["0 to .004\"", "0 to .005\"", "0 to .006\"", "0 to .007\"", "0 to .008\""], ["0 to .005\"", "0 to .006\"", "0 to .007\"", "0 to .008\"", "0 to .002\""], ["0 to .006\"", "0 to .007\"", "0 to .008\"", "0 to .002\"", "0 to .003\""], ["0 to .007\"", "0 to .008\"", "0 to .002\"", "0 to .003\"", "0 to .004\""]]}}}}