{"index": 417, "width": 847, "height": 1180, "dpi": 144.0, "blocks": [{"block_id": 0, "box": [710.0, 11.0, 740.0, 34.0], "label": "Page-header", "score": null, "order": 0, "content": null, "kind": "none"}, {"block_id": 1, "box": [51.0, 78.0, 743.0, 265.0], "label": "Text", "score": null, "order": 1, "content": null, "kind": "none"}, {"block_id": 2, "box": [51.0, 263.0, 743.0, 370.0], "label": "Text", "score": null, "order": 2, "content": null, "kind": "none"}, {"block_id": 3, "box": [51.0, 367.0, 743.0, 473.0], "label": "Text", "score": null, "order": 3, "content": null, "kind": "none"}, {"block_id": 4, "box": [51.0, 471.0, 743.0, 578.0], "label": "Text", "score": null, "order": 4, "content": null, "kind": "none"}, {"block_id": 5, "box": [51.0, 575.0, 743.0, 682.0], "label": "Text", "score": null, "order": 5, "content": null, "kind": "none"}, {"block_id": 6, "box": [75.0, 748.0, 722.0, 781.0], "label": "Section-header", "score": null, "order": 6, "content": null, "kind": "none"}, {"block_id": 7, "box": [51.0, 804.0, 109.0, 860.0], "label": "Picture", "score": null, "order": 7, "content": null, "kind": "none"}, {"block_id": 8, "box": [51.0, 808.0, 743.0, 1020.0], "label": "Text", "score": null, "order": 8, "content": null, "kind": "none"}, {"block_id": 9, "box": [51.0, 1018.0, 743.0, 1072.0], "label": "Text", "score": null, "order": 9, "content": null, "kind": "none"}, {"block_id": 10, "box": [51.0, 1070.0, 743.0, 1126.0], "label": "Text", "score": null, "order": 10, "content": null, "kind": "none"}, {"block_id": 11, "box": [647.0, 1134.0, 671.0, 1157.0], "label": "Page-footer", "score": null, "order": 11, "content": null, "kind": "none"}], "meta": {"detector": "dots.ocr", "pass_no": 0, "prompt": "layout_only_en", "reading_order": "generation_order", "input_pixel_ceiling": 1003520, "downscale": 1.0, "out_of_vram": false, "parse_error": null, "answer_truncated": false}}