{"index": 332, "width": 889, "height": 1125, "dpi": 144.0, "blocks": [], "raw": null, "meta": {"случай": "82d62e8b", "книга": "annopage", "файл": "82d62e8b-da46-4adb-bf00-8f49f3f70d2a.jpg", "объектов вне замера": {"спорно": 0, "невыразимо": 0}, "вне замера": [], "текст размечен": false, "порядок размечен": false, "ужато": 0.8526}}