{"index": 403, "width": 840, "height": 1190, "dpi": 144.0, "blocks": [{"block_id": 0, "box": [745.0, 45.0, 775.0, 72.0], "label": "Page-header", "score": null, "order": 0, "content": null, "kind": "none"}, {"block_id": 1, "box": [209.0, 113.0, 606.0, 170.0], "label": "Text", "score": null, "order": 1, "content": null, "kind": "none"}, {"block_id": 2, "box": [210.0, 168.0, 580.0, 221.0], "label": "Text", "score": null, "order": 2, "content": null, "kind": "none"}, {"block_id": 3, "box": [212.0, 220.0, 587.0, 274.0], "label": "Text", "score": null, "order": 3, "content": null, "kind": "none"}, {"block_id": 4, "box": [212.0, 272.0, 547.0, 327.0], "label": "Text", "score": null, "order": 4, "content": null, "kind": "none"}, {"block_id": 5, "box": [212.0, 324.0, 659.0, 378.0], "label": "Text", "score": null, "order": 5, "content": null, "kind": "none"}, {"block_id": 6, "box": [212.0, 376.0, 545.0, 427.0], "label": "Text", "score": null, "order": 6, "content": null, "kind": "none"}, {"block_id": 7, "box": [212.0, 428.0, 589.0, 480.0], "label": "Text", "score": null, "order": 7, "content": null, "kind": "none"}, {"block_id": 8, "box": [211.0, 479.0, 543.0, 559.0], "label": "Text", "score": null, "order": 8, "content": null, "kind": "none"}, {"block_id": 9, "box": [211.0, 558.0, 605.0, 585.0], "label": "Text", "score": null, "order": 9, "content": null, "kind": "none"}, {"block_id": 10, "box": [211.0, 585.0, 638.0, 691.0], "label": "Text", "score": null, "order": 10, "content": null, "kind": "none"}, {"block_id": 11, "box": [211.0, 690.0, 587.0, 743.0], "label": "Text", "score": null, "order": 11, "content": null, "kind": "none"}, {"block_id": 12, "box": [210.0, 742.0, 615.0, 796.0], "label": "Text", "score": null, "order": 12, "content": null, "kind": "none"}, {"block_id": 13, "box": [210.0, 795.0, 581.0, 848.0], "label": "Text", "score": null, "order": 13, "content": null, "kind": "none"}, {"block_id": 14, "box": [210.0, 847.0, 588.0, 900.0], "label": "Text", "score": null, "order": 14, "content": null, "kind": "none"}, {"block_id": 15, "box": [210.0, 899.0, 602.0, 927.0], "label": "Text", "score": null, "order": 15, "content": null, "kind": "none"}, {"block_id": 16, "box": [210.0, 926.0, 598.0, 1006.0], "label": "Text", "score": null, "order": 16, "content": null, "kind": "none"}, {"block_id": 17, "box": [210.0, 1004.0, 586.0, 1057.0], "label": "Text", "score": null, "order": 17, "content": null, "kind": "none"}, {"block_id": 18, "box": [210.0, 1056.0, 518.0, 1106.0], "label": "Text", "score": null, "order": 18, "content": null, "kind": "none"}, {"block_id": 19, "box": [609.0, 363.0, 840.0, 615.0], "label": "Picture", "score": null, "order": 19, "content": null, "kind": "none"}], "raw": {"ответ": "[{\"bbox\": [745, 45, 775, 72], \"category\": \"Page-header\"}, {\"bbox\": [209, 113, 606, 170], \"category\": \"Text\"}, {\"bbox\": [210, 168, 580, 221], \"category\": \"Text\"}, {\"bbox\": [212, 220, 587, 274], \"category\": \"Text\"}, {\"bbox\": [212, 272, 547, 327], \"category\": \"Text\"}, {\"bbox\": [212, 324, 659, 378], \"category\": \"Text\"}, {\"bbox\": [212, 376, 545, 427], \"category\": \"Text\"}, {\"bbox\": [212, 428, 589, 480], \"category\": \"Text\"}, {\"bbox\": [211, 479, 543, 559], \"category\": \"Text\"}, {\"bbox\": [211, 558, 605, 585], \"category\": \"Text\"}, {\"bbox\": [211, 585, 638, 691], \"category\": \"Text\"}, {\"bbox\": [211, 690, 587, 743], \"category\": \"Text\"}, {\"bbox\": [210, 742, 615, 796], \"category\": \"Text\"}, {\"bbox\": [210, 795, 581, 848], \"category\": \"Text\"}, {\"bbox\": [210, 847, 588, 900], \"category\": \"Text\"}, {\"bbox\": [210, 899, 602, 927], \"category\": \"Text\"}, {\"bbox\": [210, 926, 598, 1006], \"category\": \"Text\"}, {\"bbox\": [210, 1004, 586, 1057], \"category\": \"Text\"}, {\"bbox\": [210, 1056, 518, 1106], \"category\": \"Text\"}, {\"bbox\": [609, 363, 840, 615], \"category\": \"Picture\"}]"}, "meta": {"распознаватель": "dots.ocr", "проход": 0, "промт": "layout_only_en", "порядок чтения": "порядок порождения", "потолок подачи": 1003520, "ужато": 1.0, "нехватка видеопамяти": false, "ошибка разбора": null}}