{"index": 152, "width": 812, "height": 1231, "dpi": 144.0, "blocks": [{"block_id": 0, "box": [31.0, 41.0, 290.0, 274.0], "label": "Text", "score": null, "order": 0, "content": null, "kind": "none"}, {"block_id": 1, "box": [31.0, 277.0, 290.0, 640.0], "label": "Text", "score": null, "order": 1, "content": null, "kind": "none"}, {"block_id": 2, "box": [31.0, 643.0, 290.0, 815.0], "label": "Text", "score": null, "order": 2, "content": null, "kind": "none"}, {"block_id": 3, "box": [31.0, 812.0, 742.0, 857.0], "label": "Text", "score": null, "order": 3, "content": null, "kind": "none"}, {"block_id": 4, "box": [31.0, 861.0, 742.0, 950.0], "label": "Text", "score": null, "order": 4, "content": null, "kind": "none"}, {"block_id": 5, "box": [31.0, 954.0, 742.0, 1126.0], "label": "Text", "score": null, "order": 5, "content": null, "kind": "none"}, {"block_id": 6, "box": [304.0, 42.0, 747.0, 729.0], "label": "Picture", "score": null, "order": 6, "content": null, "kind": "none"}, {"block_id": 7, "box": [309.0, 736.0, 742.0, 793.0], "label": "Caption", "score": null, "order": 7, "content": null, "kind": "none"}, {"block_id": 8, "box": [706.0, 1148.0, 739.0, 1167.0], "label": "Page-footer", "score": null, "order": 8, "content": null, "kind": "none"}], "meta": {"распознаватель": "dots.ocr", "проход": 0, "промт": "layout_only_en", "порядок чтения": "порядок порождения", "потолок подачи": 1003520, "ужато": 1.0, "нехватка видеопамяти": false, "ошибка разбора": null, "обрыв ответа": false}}