{"index": 425, "width": 814, "height": 1228, "dpi": 144.0, "blocks": [], "raw": {"answer": "[{\"bbox\": [60, 29, 104, 39], \"category\": \"Page-header\"}, {\"bbox\": [381, 28, 457, 37], \"category\": \"Page-header\"}, {\"bbox\": [725, 28, 791, 37], \"category\": \"Page-header\"}, {\"bbox\": [43, 42, 228, 100], \"category\": \"Text\"}, {\"bbox\": [43, 100, 228, 168], \"category\": \"Text\"}, {\"bbox\": [43, 168, 228, 236], \"category\": \"Text\"}, {\"bbox\": [43, 236, 228, 294], \"category\": \"Text\"}, {\"bbox\": [43, 294, 228, 352], \"category\": \"Text\"}, {\"bbox\": [43, 352, 228, 400], \"category\": \"Text\"}, {\"bbox\": [43, 400, 228, 448], \"category\": \"Text\"}, {\"bbox\": [43, 448, 228, 496], \"category\": \"Text\"}, {\"bbox\": [43, 496, 228, 554], \"category\": \"Text\"}, {\"bbox\": [43, 554, 228, 602], \"category\": \"Text\"}, {\"bbox\": [43, 602, 228, 649], \"category\": \"Text\"}, {\"bbox\": [62, 653, 201, 667], \"category\": \"Section-header\"}, {\"bbox\": [62, 668, 193, 681], \"category\": \"Text\"}, {\"bbox\": [43, 681, 228, 739], \"category\": \"Text\"}, {\"bbox\": [75, 737, 197, 754], \"category\": \"Section-header\"}, {\"bbox\": [91, 756, 183, 768], \"category\": \"Text\"}, {\"bbox\": [43, 768, 228, 881], \"category\": \"Text\"}, {\"bbox\": [75, 883, 103, 894], \"category\": \"Section-header\"}, {\"bbox\": [43, 894, 228, 952], \"category\": \"Text\"}, {\"bbox\": [119, 954, 154, 965], \"category\": \"Section-header\"}, {\"bbox\": [43, 965, 228, 1045], \"category\": \"Text\"}, {\"bbox\": [121, 1049, 153, 1060], \"category\": \"Section-header\"}, {\"bbox\": [43, 1060, 228, 1118], \"category\": \"Text\"}, {\"bbox\": [43, 1118, 228, 1176], \"category\": \"Text\"}, {\"bbox\": [240, 46, 593, 336], \"category\": \"Picture\"}, {\"bbox\": [365, 343, 489, 356], \"category\": \"Caption\"}, {\"bbox\": [237, 368, 317, 381], \"category\": \"Section-header\"}, {\"bbox\": [237, 381, 317, 393], \"category\": \"Text\"}, {\"bbox\": [237, 393, 317, 405], \"category\": \"Text\"}, {\"bbox\": [237, 405, 317, 417], \"category\": \"Text\"}, {\"bbox\": [237, 417, 317, 429], \"category\": \"Text\"}, {\"bbox\": [237, 429, 317, 441], \"category\": \"Text\"}, {\"bbox\": [237, 441, 317, 453], \"category\": \"Text\"}, {\"bbox\": [237, 453, 317, 465], \"category\": \"Text\"}, {\"bbox\": [237, 465, 317, 477], \"category\": \"Text\"}, {\"bbox\": [237, 477, 317, 489], \"category\": \"Text\"}, {\"bbox\": [237, 489, 317, 501], \"category\": \"Text\"}, {\"bbox\": [237, 501, 317, 513], \"category\": \"Text\"}, {\"bbox\": [237, 513, 317, 525], \"category\": \"Text\"}, {\"bbox\": [237, 525, 317, 537], \"category\": \"Text\"}, {\"bbox\": [237, 537, 317, 549], \"category\": \"Text\"}, {\"bbox\": [237, 549, 317, 561], \"category\": \"Text\"}, {\"bbox\": [237, 561, 317, 573], \"category\": \"Text\"}, {\"bbox\": [237, 573, 317, 585], \"category\": \"Text\"}, {\"bbox\": [237, 585, 317, 597], \"category\": \"Text\"}, {\"bbox\": [237, 597, 317, 609], \"category\": \"Text\"}, {\"bbox\": [237, 609, 317, 621], \"category\": \"Text\"}, {\"bbox\": [237, 621, 317, 633], \"category\": \"Text\"}, {\"bbox\": [237, 633, 317, 645], \"category\": \"Text\"}, {\"bbox\": [237, 645, 317, 657], \"category\": \"Text\"}, {\"bbox\": [237, 657, 317, 669], \"category\": \"Text\"}, {\"bbox\": [237, 669, 317, 681], \"category\": \"Text\"}, {\"bbox\": [237, 681, 317, 693], \"category\": \"Text\"}, {\"bbox\": [237, 693, 317, 705], \"category\": \"Text\"}, {\"bbox\": [237, 705, 317, 717], \"category\": \"Text\"}, {\"bbox\": [237, 717, 317, 729], \"category\": \"Text\"}, {\"bbox\": [237, 729, 317, 741], \"category\": \"Text\"}, {\"bbox\": [237, 741, 317, 753], \"category\": \"Text\"}, {\"bbox\": [237, 753, 317, 765], \"category\": \"Text\"}, {\"bbox\": [237, 765, 317, 777], \"category\": \"Text\"}, {\"bbox\": [237, 777, 317, 789], \"category\": \"Text\"}, {\"bbox\": [237, 789, 317, 801], \"category\": \"Text\"}, {\"bbox\": [237, 801, 317, 813], \"category\": \"Text\"}, {\"bbox\": [237, 813, 317, 825], \"category\": \"Text\"}, {\"bbox\": [237, 825, 317, 837], \"category\": \"Text\"}, {\"bbox\": [237, 837, 317, 849], \"category\": \"Text\"}, {\"bbox\": [237, 849, 317, 861], \"category\": \"Text\"}, {\"bbox\": [237, 861, 317, 873], \"category\": \"Text\"}, {\"bbox\": [237, 873, 317, 885], \"category\": \"Text\"}, {\"bbox\": [237, 885, 317, 897], \"category\": \"Text\"}, {\"bbox\": [237, 897, 317, 909], \"category\": \"Text\"}, {\"bbox\": [237, 909, 317, 921], \"category\": \"Text\"}, {\"bbox\": [237, 921, 317, 933], \"category\": \"Text\"}, {\"bbox\": [237, 933, 317, 945], \"category\": \"Text\"}, {\"bbox\": [237, 945, 317, 957], \"category\": \"Text\"}, {\"bbox\": [237, 957, 317, 969], \"category\": \"Text\"}, {\"bbox\": [237, 969, 317, 981], \"category\": \"Text\"}, {\"bbox\": [237, 981, 317, 993], \"category\": \"Text\"}, {\"bbox\": [237, 993, 317, 1005], \"category\": \"Text\"}, {\"bbox\": [237, 1005, 317, 1017], \"category\": \"Text\"}, {\"bbox\": [237, 1017, 317, 1029], \"category\": \"Text\"}, {\"bbox\": [237, 1029, 317, 1041], \"category\": \"Text\"}, {\"bbox\": [237, 1041, 317, 1053], \"category\": \"Text\"}, {\"bbox\": [237, 1053, 317, 1065], \"category\": \"Text\"}, {\"bbox\": [237, 1065, 317, 1077], \"category\": \"Text\"}, {\"bbox\": [237, 1077, 317, 1089], \"category\": \"Text\"}, {\"bbox\": [237, 1089, 317, 1101], \"category\": \"Text\"}, {\"bbox\": [237, 1101, 317, 1113], \"category\": \"Text\"}, {\"bbox\": [237, 1113, 317, 1125], \"category\": \"Text\"}, {\"bbox\": [237, 1125, 317, 1137], \"category\": \"Text\"}, {\"bbox\": [237, 1137, 317, 1149], \"category\": \"Text\"}, {\"bbox\": [237, 1149, 317, 1161], \"category\": \"Text\"}, {\"bbox\": [237, 1161, 317, 1173], \"category\": \"Text\"}, {\"bbox\": [237, 1173, 317, 1185], \"category\": \"Text\"}, {\"bbox\": [237, 1185, 317, 1197], \"category\": \"Text\"}, {\"bbox\": [237, 1197, 317, 1209], \"category\": \"Text\"}, {\"bbox\": [237, 1209, 317, 1221], \"category\": \"Text\"}, {\"bbox\": [237, 1221, 317, 1233], \"category\": \"Text\"}, {\"bbox\": [237, 1233, 317, 1245], \"category\": \"Text\"}, {\"bbox\": [237, 1245, 317, 1257], \"category\": \"Text\"}, {\"bbox\": [237, 1257, 317, 1269], \"category\": \"Text\"}, {\"bbox\": [237, 1269, 317, 1281], \"category\": \"Text\"}, {\"bbox\": [237, 1281, 317, 1293], \"category\": \"Text\"}, {\"bbox\": [237, 1293, 317, 1305], \"category\": \"Text\"}, {\"bbox\": [237, 1305, 317, 1317], \"category\": \"Text\"}, {\"bbox\": [237, 1317, 317, 1329], \"category\": \"Text\"}, {\"bbox\": [237, 1329, 317, 1341], \"category\": \"Text\"}, {\"bbox\": [237, 1341, 317, 1353], \"category\": \"Text\"}, {\"bbox\": [237, 1353, 317, 1365], \"category\": \"Text\"}, {\"bbox\": [237, 1365, 317, 1377], \"category\": \"Text\"}, {\"bbox\": [237, 1377, 317, 1389], \"category\": \"Text\"}, {\"bbox\": [237, 1389, 317, 1401], \"category\": \"Text\"}, {\"bbox\": [237, 1401, 317, 1413], \"category\": \"Text\"}, {\"bbox\": [237, 1413, 317, 1425], \"category\": \"Text\"}, {\"bbox\": [237, 1425, 317, 1437], \"category\": \"Text\"}, {\"bbox\": [237, 1437, 317, 1449], \"category\": \"Text\"}, {\"bbox\": [237, 1449, 317, 1461], \"category\": \"Text\"}, {\"bbox\": [237, 1461, 317, 1473], \"category\": \"Text\"}, {\"bbox\": [237, 1473, 317, 1485], \"category\": \"Text\"}, {\"bbox\": [237, 1485, 317, 1497], \"category\": \"Text\"}, {\"bbox\": [237, 1497, 317, 1509], \"category\": \"Text\"}, {\"bbox\": [237, 1509, 317, 1521], \"category\": \"Text\"}, {\"bbox\": [237, 1521, 317, 1533], \"category\": \"Text\"}, {\"bbox\": [237, 1533, 317, 1545], \"category\": \"Text\"}, {\"bbox\": [237, 1545, 317, 1557], \"category\": \"Text\"}, {\"bbox\": [237, 1557, 317, 1569], \"category\": \"Text\"}, {\"bbox\": [237, 1569, 317, 1581], \"category\": \"Text\"}, {\"bbox\": [237, 1581, 317, 1593], \"category\": \"Text\"}, {\"bbox\": [237, 1593, 317, 1605], \"category\": \"Text\"}, {\"bbox\": [237, 1605, 317, 1617], \"category\": \"Text\"}, {\"bbox\": [237, 1617, 317, 1629], \"category\": \"Text\"}, {\"bbox\": [237, 1629, 317, 1641], \"category\": \"Text\"}, {\"bbox\": [237, 1641, 317, 1653], \"category\": \"Text\"}, {\"bbox\": [237, 1653, 317, 1665], \"category\": \"Text\"}, {\"bbox\": [237, 1665, 317, 1677], \""}, "meta": {"detector": "dots.ocr", "pass_no": 0, "prompt": "layout_only_en", "reading_order": "generation_order", "input_pixel_ceiling": 1003520, "downscale": 1.0, "out_of_vram": false, "parse_error": "JSONDecodeError: Expecting ',' delimiter: line 1 column 7331 (char 7330)"}}