{"index": 14, "width": 1308, "height": 1800, "dpi": 144.0, "blocks": [{"block_id": 0, "box": [163.89318157907684, 140.91750191845858, 189.93228519444418, 163.89318157907684], "label": "Page-header", "score": null, "order": 0, "content": null, "kind": "none"}, {"block_id": 1, "box": [160.82975762432773, 197.59084508131693, 673.9532700448019, 246.60562835730252], "label": "Text", "score": null, "order": 1, "content": null, "kind": "none"}, {"block_id": 2, "box": [160.82975762432773, 245.07391637992797, 673.9532700448019, 500.8698166014778], "label": "Text", "score": null, "order": 2, "content": null, "kind": "none"}, {"block_id": 3, "box": [160.82975762432773, 499.33810462410327, 673.9532700448019, 666.2947101579292], "label": "Text", "score": null, "order": 3, "content": null, "kind": "none"}, {"block_id": 4, "box": [696.9289497054201, 197.59084508131693, 1214.647598058018, 456.45016925761587], "label": "Text", "score": null, "order": 4, "content": null, "kind": "none"}, {"block_id": 5, "box": [696.9289497054201, 454.9184572802413, 1214.647598058018, 666.2947101579292], "label": "Text", "score": null, "order": 5, "content": null, "kind": "none"}, {"block_id": 6, "box": [219.03481276456063, 727.5631892529111, 306.34239547490995, 1029.3104487956975], "label": "Picture", "score": null, "order": 6, "content": null, "kind": "none"}, {"block_id": 7, "box": [314.0009553617827, 1036.9690086825701, 326.2546511807791, 1055.349552411065], "label": "Caption", "score": null, "order": 7, "content": null, "kind": "none"}, {"block_id": 8, "box": [485.5526968277323, 727.5631892529111, 655.5727263163074, 1029.3104487956975], "label": "Picture", "score": null, "order": 8, "content": null, "kind": "none"}, {"block_id": 9, "box": [562.1382956964597, 1010.9299050672029, 575.9237034928308, 1027.7787368183228], "label": "Caption", "score": null, "order": 9, "content": null, "kind": "none"}, {"block_id": 10, "box": [696.9289497054201, 727.5631892529111, 866.9489791939952, 1029.3104487956975], "label": "Picture", "score": null, "order": 10, "content": null, "kind": "none"}, {"block_id": 11, "box": [804.1487881216386, 1010.9299050672029, 817.9341959180096, 1027.7787368183228], "label": "Caption", "score": null, "order": 11, "content": null, "kind": "none"}, {"block_id": 12, "box": [942.0028660853482, 727.5631892529111, 1167.164526759407, 1029.3104487956975], "label": "Picture", "score": null, "order": 12, "content": null, "kind": "none"}, {"block_id": 13, "box": [1058.4129763658138, 1010.9299050672029, 1072.1983841621848, 1027.7787368183228], "label": "Caption", "score": null, "order": 13, "content": null, "kind": "none"}, {"block_id": 14, "box": [165.42489355645137, 1089.0472159133049, 1213.1158860806433, 1151.8474069856616], "label": "Caption", "score": null, "order": 14, "content": null, "kind": "none"}, {"block_id": 15, "box": [165.42489355645137, 1168.6962387367814, 673.9532700448019, 1242.2184136507599], "label": "Text", "score": null, "order": 15, "content": null, "kind": "none"}, {"block_id": 16, "box": [165.42489355645137, 1239.1549896960107, 673.9532700448019, 1660.375783474012], "label": "Text", "score": null, "order": 16, "content": null, "kind": "none"}, {"block_id": 17, "box": [699.9923736601693, 1168.6962387367814, 1214.647598058018, 1427.5555629130804], "label": "Text", "score": null, "order": 17, "content": null, "kind": "none"}, {"block_id": 18, "box": [699.9923736601693, 1426.023850935706, 1214.647598058018, 1543.9656731935463], "label": "Text", "score": null, "order": 18, "content": null, "kind": "none"}, {"block_id": 19, "box": [699.9923736601693, 1542.4339612161716, 1214.647598058018, 1591.4487444921572], "label": "Text", "score": null, "order": 19, "content": null, "kind": "none"}, {"block_id": 20, "box": [699.9923736601693, 1589.9170325147827, 1214.647598058018, 1661.9074954513865], "label": "Text", "score": null, "order": 20, "content": null, "kind": "none"}], "raw": null, "meta": {"распознаватель": "dots.ocr", "порядок чтения": "порядок порождения", "ужато": 0.6529, "разобрано дома": true}}