{"index": 486, "width": 869, "height": 1151, "dpi": 144.0, "blocks": [{"block_id": 0, "box": [138.0, 551.0, 301.0, 863.0], "label": "Text", "score": null, "order": 0, "content": null, "kind": "none"}, {"block_id": 1, "box": [451.0, 295.0, 618.0, 571.0], "label": "Text", "score": null, "order": 1, "content": null, "kind": "none"}, {"block_id": 2, "box": [273.0, 899.0, 751.0, 937.0], "label": "Text", "score": null, "order": 2, "content": null, "kind": "none"}], "raw": {"answer": "[{\"bbox\": [138, 551, 301, 863], \"category\": \"Text\"}, {\"bbox\": [451, 295, 618, 571], \"category\": \"Text\"}, {\"bbox\": [273, 899, 751, 937], \"category\": \"Text\"}]"}, "meta": {"detector": "dots.ocr", "pass_no": 0, "prompt": "layout_only_en", "reading_order": "generation_order", "input_pixel_ceiling": 1003520, "downscale": 1.0, "out_of_vram": false, "parse_error": null}}