{"index": 588, "width": 1500, "height": 2276, "dpi": 144.0, "blocks": [{"block_id": 0, "box": [160.6, 666.5, 1195.2, 1107.8], "label": "image", "score": null, "order": 0, "content": null, "kind": "none", "source_category": "Other technical drawing"}, {"block_id": 1, "box": [490.9, 85.9, 1113.2, 154.4], "label": "display_formula", "score": null, "order": 1, "content": null, "kind": "none", "source_category": "Chemical formula and equation"}], "raw": null, "meta": {"case": "f245ca96", "book": "annopage", "file": "f245ca96-88d5-4990-a6e5-f48b0c3f0302.jpg", "objects_out_of_scope": {"doubtful": 0, "inexpressible": 0}, "out_of_scope": [], "text_marked": false, "order_marked": false}}