{"index": 543, "width": 850, "height": 1177, "dpi": 144.0, "blocks": [], "raw": null, "meta": {"case": "e9cc5600", "book": "annopage", "file": "e9cc5600-c86d-11e3-85ae-001018b5eb5c.jpg", "objects_out_of_scope": {"doubtful": 1, "inexpressible": 2}, "out_of_scope": [{"box": [95.2, 133.0, 750.9, 777.3], "category": "Caricature and comics", "bucket": "disputed"}, {"box": [156.6, 133.4, 697.4, 338.3], "category": "Decorative inscription", "bucket": "inexpressible"}, {"box": [337.0, 630.4, 447.0, 765.9], "category": "Initial", "bucket": "inexpressible"}], "text_marked": false, "order_marked": false, "downscale": 0.5664}}