{"index": 534, "width": 843, "height": 1186, "dpi": 144.0, "blocks": [{"block_id": 0, "box": [426.0, 93.0, 442.0, 105.0], "label": "Page-header", "score": null, "order": 0, "content": null, "kind": "none"}, {"block_id": 1, "box": [197.0, 124.0, 336.0, 148.0], "label": "Section-header", "score": null, "order": 1, "content": null, "kind": "none"}, {"block_id": 2, "box": [103.0, 155.0, 419.0, 491.0], "label": "Picture", "score": null, "order": 2, "content": null, "kind": "none"}, {"block_id": 3, "box": [103.0, 500.0, 424.0, 698.0], "label": "Text", "score": null, "order": 3, "content": null, "kind": "none"}, {"block_id": 4, "box": [511.0, 124.0, 706.0, 149.0], "label": "Section-header", "score": null, "order": 4, "content": null, "kind": "none"}, {"block_id": 5, "box": [462.0, 168.0, 766.0, 504.0], "label": "Picture", "score": null, "order": 5, "content": null, "kind": "none"}, {"block_id": 6, "box": [444.0, 512.0, 766.0, 700.0], "label": "Text", "score": null, "order": 6, "content": null, "kind": "none"}, {"block_id": 7, "box": [148.0, 725.0, 378.0, 753.0], "label": "Section-header", "score": null, "order": 7, "content": null, "kind": "none"}, {"block_id": 8, "box": [103.0, 756.0, 354.0, 778.0], "label": "Text", "score": null, "order": 8, "content": null, "kind": "none"}, {"block_id": 9, "box": [358.0, 778.0, 423.0, 796.0], "label": "Text", "score": null, "order": 9, "content": null, "kind": "none"}, {"block_id": 10, "box": [103.0, 801.0, 424.0, 842.0], "label": "Text", "score": null, "order": 10, "content": null, "kind": "none"}, {"block_id": 11, "box": [352.0, 822.0, 423.0, 843.0], "label": "Text", "score": null, "order": 11, "content": null, "kind": "none"}, {"block_id": 12, "box": [103.0, 846.0, 387.0, 868.0], "label": "Text", "score": null, "order": 12, "content": null, "kind": "none"}, {"block_id": 13, "box": [362.0, 868.0, 422.0, 886.0], "label": "Text", "score": null, "order": 13, "content": null, "kind": "none"}, {"block_id": 14, "box": [103.0, 891.0, 423.0, 931.0], "label": "Text", "score": null, "order": 14, "content": null, "kind": "none"}, {"block_id": 15, "box": [320.0, 913.0, 423.0, 932.0], "label": "Text", "score": null, "order": 15, "content": null, "kind": "none"}, {"block_id": 16, "box": [103.0, 933.0, 423.0, 958.0], "label": "Text", "score": null, "order": 16, "content": null, "kind": "none"}, {"block_id": 17, "box": [103.0, 961.0, 371.0, 981.0], "label": "Text", "score": null, "order": 17, "content": null, "kind": "none"}, {"block_id": 18, "box": [297.0, 983.0, 423.0, 1003.0], "label": "Text", "score": null, "order": 18, "content": null, "kind": "none"}, {"block_id": 19, "box": [103.0, 1006.0, 375.0, 1026.0], "label": "Text", "score": null, "order": 19, "content": null, "kind": "none"}, {"block_id": 20, "box": [291.0, 1026.0, 423.0, 1047.0], "label": "Text", "score": null, "order": 20, "content": null, "kind": "none"}, {"block_id": 21, "box": [384.0, 1047.0, 403.0, 1065.0], "label": "Text", "score": null, "order": 21, "content": null, "kind": "none"}, {"block_id": 22, "box": [528.0, 725.0, 680.0, 749.0], "label": "Section-header", "score": null, "order": 22, "content": null, "kind": "none"}, {"block_id": 23, "box": [444.0, 751.0, 766.0, 854.0], "label": "Text", "score": null, "order": 23, "content": null, "kind": "none"}, {"block_id": 24, "box": [572.0, 865.0, 639.0, 907.0], "label": "Picture", "score": null, "order": 24, "content": null, "kind": "none"}, {"block_id": 25, "box": [565.0, 917.0, 644.0, 941.0], "label": "Section-header", "score": null, "order": 25, "content": null, "kind": "none"}, {"block_id": 26, "box": [444.0, 943.0, 766.0, 1068.0], "label": "Text", "score": null, "order": 26, "content": null, "kind": "none"}], "raw": {"answer": "[{\"bbox\": [426, 93, 442, 105], \"category\": \"Page-header\"}, {\"bbox\": [197, 124, 336, 148], \"category\": \"Section-header\"}, {\"bbox\": [103, 155, 419, 491], \"category\": \"Picture\"}, {\"bbox\": [103, 500, 424, 698], \"category\": \"Text\"}, {\"bbox\": [511, 124, 706, 149], \"category\": \"Section-header\"}, {\"bbox\": [462, 168, 766, 504], \"category\": \"Picture\"}, {\"bbox\": [444, 512, 766, 700], \"category\": \"Text\"}, {\"bbox\": [148, 725, 378, 753], \"category\": \"Section-header\"}, {\"bbox\": [103, 756, 354, 778], \"category\": \"Text\"}, {\"bbox\": [358, 778, 423, 796], \"category\": \"Text\"}, {\"bbox\": [103, 801, 424, 842], \"category\": \"Text\"}, {\"bbox\": [352, 822, 423, 843], \"category\": \"Text\"}, {\"bbox\": [103, 846, 387, 868], \"category\": \"Text\"}, {\"bbox\": [362, 868, 422, 886], \"category\": \"Text\"}, {\"bbox\": [103, 891, 423, 931], \"category\": \"Text\"}, {\"bbox\": [320, 913, 423, 932], \"category\": \"Text\"}, {\"bbox\": [103, 933, 423, 958], \"category\": \"Text\"}, {\"bbox\": [103, 961, 371, 981], \"category\": \"Text\"}, {\"bbox\": [297, 983, 423, 1003], \"category\": \"Text\"}, {\"bbox\": [103, 1006, 375, 1026], \"category\": \"Text\"}, {\"bbox\": [291, 1026, 423, 1047], \"category\": \"Text\"}, {\"bbox\": [384, 1047, 403, 1065], \"category\": \"Text\"}, {\"bbox\": [528, 725, 680, 749], \"category\": \"Section-header\"}, {\"bbox\": [444, 751, 766, 854], \"category\": \"Text\"}, {\"bbox\": [572, 865, 639, 907], \"category\": \"Picture\"}, {\"bbox\": [565, 917, 644, 941], \"category\": \"Section-header\"}, {\"bbox\": [444, 943, 766, 1068], \"category\": \"Text\"}]"}, "meta": {"detector": "dots.ocr", "pass_no": 0, "prompt": "layout_only_en", "reading_order": "generation_order", "input_pixel_ceiling": 1003520, "downscale": 1.0, "out_of_vram": false, "parse_error": null}}