{"index": 46, "width": 1500, "height": 2099, "dpi": 144.0, "blocks": [], "raw": null, "meta": {"случай": "120ca7d6", "книга": "annopage", "файл": "120ca7d6-0ae0-11e6-8955-001b63bd97ba.jpg", "объектов вне замера": {"спорно": 6, "невыразимо": 0}, "вне замера": [{"box": [134.9, 68.4, 1328.4, 388.3], "категория": "Musical notation", "разряд": "спорно"}, {"box": [144.9, 394.3, 1330.0, 711.5], "категория": "Musical notation", "разряд": "спорно"}, {"box": [142.0, 729.9, 1326.2, 1029.7], "категория": "Musical notation", "разряд": "спорно"}, {"box": [142.9, 1072.7, 1337.5, 1348.7], "категория": "Musical notation", "разряд": "спорно"}, {"box": [148.4, 1367.5, 1341.9, 1664.7], "категория": "Musical notation", "разряд": "спорно"}, {"box": [144.2, 1683.5, 1343.3, 1975.3], "категория": "Musical notation", "разряд": "спорно"}], "текст размечен": false, "порядок размечен": false}}