{"index": 288, "width": 814, "height": 1229, "dpi": 144.0, "blocks": [{"block_id": 0, "box": [118.0, 69.0, 513.0, 94.0], "label": "Text", "score": null, "order": 0, "content": null, "kind": "none"}, {"block_id": 1, "box": [239.0, 101.0, 626.0, 128.0], "label": "Formula", "score": null, "order": 1, "content": null, "kind": "none"}, {"block_id": 2, "box": [74.0, 125.0, 620.0, 150.0], "label": "Formula", "score": null, "order": 2, "content": null, "kind": "none"}, {"block_id": 3, "box": [74.0, 156.0, 780.0, 229.0], "label": "Text", "score": null, "order": 3, "content": null, "kind": "none"}, {"block_id": 4, "box": [340.0, 231.0, 779.0, 299.0], "label": "Text", "score": null, "order": 4, "content": null, "kind": "none"}, {"block_id": 5, "box": [340.0, 309.0, 779.0, 402.0], "label": "Text", "score": null, "order": 5, "content": null, "kind": "none"}, {"block_id": 6, "box": [340.0, 413.0, 779.0, 507.0], "label": "Text", "score": null, "order": 6, "content": null, "kind": "none"}, {"block_id": 7, "box": [340.0, 513.0, 779.0, 607.0], "label": "Text", "score": null, "order": 7, "content": null, "kind": "none"}, {"block_id": 8, "box": [340.0, 622.0, 779.0, 694.0], "label": "Text", "score": null, "order": 8, "content": null, "kind": "none"}, {"block_id": 9, "box": [340.0, 703.0, 773.0, 775.0], "label": "Text", "score": null, "order": 9, "content": null, "kind": "none"}, {"block_id": 10, "box": [340.0, 785.0, 718.0, 859.0], "label": "Text", "score": null, "order": 10, "content": null, "kind": "none"}, {"block_id": 11, "box": [340.0, 868.0, 780.0, 940.0], "label": "Text", "score": null, "order": 11, "content": null, "kind": "none"}, {"block_id": 12, "box": [144.0, 251.0, 302.0, 863.0], "label": "Picture", "score": null, "order": 12, "content": null, "kind": "none"}, {"block_id": 13, "box": [104.0, 896.0, 299.0, 937.0], "label": "Caption", "score": null, "order": 13, "content": null, "kind": "none"}, {"block_id": 14, "box": [387.0, 971.0, 466.0, 991.0], "label": "Section-header", "score": null, "order": 14, "content": null, "kind": "none"}, {"block_id": 15, "box": [71.0, 1006.0, 779.0, 1099.0], "label": "Text", "score": null, "order": 15, "content": null, "kind": "none"}, {"block_id": 16, "box": [74.0, 1129.0, 98.0, 1148.0], "label": "Page-footer", "score": null, "order": 16, "content": null, "kind": "none"}], "raw": {"ответ": "[{\"bbox\": [118, 69, 513, 94], \"category\": \"Text\"}, {\"bbox\": [239, 101, 626, 128], \"category\": \"Formula\"}, {\"bbox\": [74, 125, 620, 150], \"category\": \"Formula\"}, {\"bbox\": [74, 156, 780, 229], \"category\": \"Text\"}, {\"bbox\": [340, 231, 779, 299], \"category\": \"Text\"}, {\"bbox\": [340, 309, 779, 402], \"category\": \"Text\"}, {\"bbox\": [340, 413, 779, 507], \"category\": \"Text\"}, {\"bbox\": [340, 513, 779, 607], \"category\": \"Text\"}, {\"bbox\": [340, 622, 779, 694], \"category\": \"Text\"}, {\"bbox\": [340, 703, 773, 775], \"category\": \"Text\"}, {\"bbox\": [340, 785, 718, 859], \"category\": \"Text\"}, {\"bbox\": [340, 868, 780, 940], \"category\": \"Text\"}, {\"bbox\": [144, 251, 302, 863], \"category\": \"Picture\"}, {\"bbox\": [104, 896, 299, 937], \"category\": \"Caption\"}, {\"bbox\": [387, 971, 466, 991], \"category\": \"Section-header\"}, {\"bbox\": [71, 1006, 779, 1099], \"category\": \"Text\"}, {\"bbox\": [74, 1129, 98, 1148], \"category\": \"Page-footer\"}]"}, "meta": {"распознаватель": "dots.ocr", "проход": 0, "промт": "layout_only_en", "порядок чтения": "порядок порождения", "потолок подачи": 1003520, "ужато": 1.0, "нехватка видеопамяти": false, "ошибка разбора": null}}