{"index": 328, "width": 2231, "height": 3392, "dpi": 144.0, "blocks": [], "raw": null, "meta": {"случай": "821a4870", "книга": "annopage", "файл": "821a4870-068e-4eeb-a687-e37f0597f739.jpg", "объектов вне замера": {"спорно": 2, "невыразимо": 1}, "вне замера": [{"box": [3.9, 1.1, 736.8, 915.5], "категория": "Exlibris", "разряд": "невыразимо"}, {"box": [754.1, 401.1, 1073.5, 603.2], "категория": "Handwritten note", "разряд": "спорно"}, {"box": [142.8, 629.7, 493.2, 813.0], "категория": "Handwritten note", "разряд": "спорно"}], "текст размечен": false, "порядок размечен": false}}