{"index": 295, "width": 2634, "height": 4121, "dpi": 144.0, "blocks": [{"block_id": 0, "box": [1780.9, 3404.3, 2285.8, 3887.5], "label": "image", "score": null, "order": 0, "content": null, "kind": "none", "source_category": "Image"}, {"block_id": 1, "box": [1775.5, 3393.4, 2546.4, 3876.7], "label": "image", "score": null, "order": 1, "content": null, "kind": "none", "source_category": "Image"}, {"block_id": 2, "box": [1775.5, 3208.8, 2579.0, 3328.3], "label": "table", "score": null, "order": 2, "content": null, "kind": "none", "source_category": "Table"}, {"block_id": 3, "box": [58.6, 547.5, 490.6, 975.9], "label": "table", "score": null, "order": 3, "content": null, "kind": "none", "source_category": "Table"}], "raw": null, "meta": {"case": "63c651b3", "book": "annopage", "file": "63c651b3-fa5a-11e5-b9c8-001b21d0d3a4.jpg", "objects_out_of_scope": {"doubtful": 15, "inexpressible": 1}, "out_of_scope": [{"box": [1666.9, 168.3, 2437.9, 1335.7], "category": "Caricature and comics", "bucket": "disputed"}, {"box": [488.7, 168.3, 2546.4, 1368.2], "category": "Advertisement", "bucket": "disputed"}, {"box": [59.7, 168.3, 483.2, 472.4], "category": "Advertisement", "bucket": "disputed"}, {"box": [59.7, 1362.8, 2557.3, 1531.1], "category": "Advertisement", "bucket": "disputed"}, {"box": [86.9, 1547.4, 1303.1, 2193.5], "category": "Advertisement", "bucket": "disputed"}, {"box": [1351.9, 1547.4, 2562.7, 2492.1], "category": "Advertisement", "bucket": "disputed"}, {"box": [1357.4, 2513.9, 2557.3, 3024.2], "category": "Advertisement", "bucket": "disputed"}, {"box": [76.0, 2291.3, 1319.4, 3051.4], "category": "Advertisement", "bucket": "disputed"}, {"box": [1770.0, 3409.7, 2573.6, 3947.3], "category": "Advertisement", "bucket": "disputed"}, {"box": [933.9, 3078.5, 1742.9, 3469.5], "category": "Advertisement", "bucket": "disputed"}, {"box": [92.3, 3089.4, 906.7, 3426.0], "category": "Advertisement", "bucket": "disputed"}, {"box": [92.3, 3436.9, 895.9, 3697.5], "category": "Advertisement", "bucket": "disputed"}, {"box": [86.9, 3697.5, 906.7, 3990.7], "category": "Advertisement", "bucket": "disputed"}, {"box": [901.3, 3491.2, 1770.0, 4007.0], "category": "Advertisement", "bucket": "disputed"}, {"box": [1770.0, 3073.1, 2589.9, 3366.3], "category": "Advertisement", "bucket": "disputed"}, {"box": [609.9, 246.4, 1557.0, 1209.6], "category": "Decorative inscription", "bucket": "inexpressible"}], "text_marked": false, "order_marked": false}}