{"index": 125, "width": 841, "height": 1189, "dpi": 144.0, "blocks": [{"block_id": 0, "box": [55.0, 37.0, 802.0, 790.0], "label": "Picture", "score": null, "order": 0, "content": null, "kind": "none"}, {"block_id": 1, "box": [516.0, 102.0, 752.0, 189.0], "label": "Text", "score": null, "order": 1, "content": null, "kind": "none"}, {"block_id": 2, "box": [47.0, 791.0, 804.0, 912.0], "label": "Title", "score": null, "order": 2, "content": null, "kind": "none"}, {"block_id": 3, "box": [330.0, 912.0, 530.0, 1082.0], "label": "Picture", "score": null, "order": 3, "content": null, "kind": "none"}, {"block_id": 4, "box": [47.0, 1031.0, 313.0, 1075.0], "label": "Text", "score": null, "order": 4, "content": null, "kind": "none"}, {"block_id": 5, "box": [608.0, 1027.0, 814.0, 1073.0], "label": "Text", "score": null, "order": 5, "content": null, "kind": "none"}, {"block_id": 6, "box": [254.0, 1099.0, 598.0, 1122.0], "label": "Text", "score": null, "order": 6, "content": null, "kind": "none"}, {"block_id": 7, "box": [375.0, 1142.0, 490.0, 1166.0], "label": "Text", "score": null, "order": 7, "content": null, "kind": "none"}], "raw": {"ответ": "[{\"bbox\": [55, 37, 802, 790], \"category\": \"Picture\"}, {\"bbox\": [516, 102, 752, 189], \"category\": \"Text\"}, {\"bbox\": [47, 791, 804, 912], \"category\": \"Title\"}, {\"bbox\": [330, 912, 530, 1082], \"category\": \"Picture\"}, {\"bbox\": [47, 1031, 313, 1075], \"category\": \"Text\"}, {\"bbox\": [608, 1027, 814, 1073], \"category\": \"Text\"}, {\"bbox\": [254, 1099, 598, 1122], \"category\": \"Text\"}, {\"bbox\": [375, 1142, 490, 1166], \"category\": \"Text\"}]"}, "meta": {"распознаватель": "dots.ocr", "проход": 0, "промт": "layout_only_en", "порядок чтения": "порядок порождения", "потолок подачи": 1003520, "ужато": 1.0, "нехватка видеопамяти": false, "ошибка разбора": null}}