{"index": 93, "width": 837, "height": 1195, "dpi": 144.0, "blocks": [{"block_id": 0, "box": [76.3, 147.7, 703.7, 957.8], "label": "image", "score": null, "order": 0, "content": null, "kind": "none", "source_category": "Photograph"}], "raw": null, "meta": {"case": "24f6864f", "book": "annopage", "file": "24f6864f-3a5f-4fca-9b56-49f1b155540e.jpg", "objects_out_of_scope": {"doubtful": 0, "inexpressible": 0}, "out_of_scope": [], "text_marked": false, "order_marked": false, "downscale": 0.5578}}