{"index": 374, "width": 811, "height": 1234, "dpi": 144.0, "blocks": [{"block_id": 0, "box": [595.3, 195.8, 778.7, 448.2], "label": "chart", "score": null, "order": 0, "content": null, "kind": "none", "source_category": "Graph"}, {"block_id": 1, "box": [57.7, 187.9, 306.7, 441.4], "label": "chart", "score": null, "order": 1, "content": null, "kind": "none", "source_category": "Graph"}, {"block_id": 2, "box": [264.8, 682.5, 614.6, 708.5], "label": "display_formula", "score": null, "order": 2, "content": null, "kind": "none", "source_category": "Chemical formula and equation"}, {"block_id": 3, "box": [260.3, 704.0, 614.6, 730.0], "label": "display_formula", "score": null, "order": 3, "content": null, "kind": "none", "source_category": "Chemical formula and equation"}], "raw": null, "meta": {"case": "b08a6663", "book": "annopage", "file": "b08a6663-d9f3-410c-8c34-76c8ba5e00f9.jpg", "objects_out_of_scope": {"doubtful": 0, "inexpressible": 0}, "out_of_scope": [], "text_marked": false, "order_marked": false, "downscale": 0.5404}}