{"index": 55, "width": 1500, "height": 2273, "dpi": 144.0, "blocks": [{"block_id": 0, "box": [284.0, 258.0, 550.0, 302.0], "label": "display_formula", "score": null, "order": 0, "content": null, "kind": "none", "source_category": "Chemical formula and equation"}, {"block_id": 1, "box": [242.0, 413.0, 548.5, 457.0], "label": "display_formula", "score": null, "order": 1, "content": null, "kind": "none", "source_category": "Chemical formula and equation"}, {"block_id": 2, "box": [323.0, 1391.0, 1094.0, 1683.0], "label": "display_formula", "score": null, "order": 2, "content": null, "kind": "none", "source_category": "Chemical formula and equation"}, {"block_id": 3, "box": [331.0, 1123.0, 484.0, 1295.0], "label": "display_formula", "score": null, "order": 3, "content": null, "kind": "none", "source_category": "Chemical formula and equation"}, {"block_id": 4, "box": [802.0, 1131.0, 1009.0, 1303.0], "label": "display_formula", "score": null, "order": 4, "content": null, "kind": "none", "source_category": "Chemical formula and equation"}, {"block_id": 5, "box": [828.3, 286.3, 1329.9, 940.9], "label": "image", "score": null, "order": 5, "content": null, "kind": "none", "source_category": "Image"}, {"block_id": 6, "box": [504.8, 1925.0, 1348.1, 2044.1], "label": "display_formula", "score": null, "order": 6, "content": null, "kind": "none", "source_category": "Chemical formula and equation"}], "raw": null, "meta": {"case": "1503a0b8", "book": "annopage", "file": "1503a0b8-857a-4ed5-ab9f-d30f487598e9.jpg", "objects_out_of_scope": {"doubtful": 0, "inexpressible": 0}, "out_of_scope": [], "text_marked": false, "order_marked": false}}