{"index": 45, "width": 1500, "height": 2298, "dpi": 144.0, "blocks": [], "raw": null, "meta": {"case": "1209d19e", "book": "annopage", "file": "1209d19e-dd89-11e6-bafc-001b63bd97ba.jpg", "objects_out_of_scope": {"doubtful": 3, "inexpressible": 0}, "out_of_scope": [{"box": [228.0, 1736.9, 1390.8, 2166.2], "category": "Musical notation", "bucket": "disputed"}, {"box": [234.6, 1321.3, 1392.5, 1698.5], "category": "Musical notation", "bucket": "disputed"}, {"box": [232.9, 963.0, 1397.0, 1229.8], "category": "Musical notation", "bucket": "disputed"}], "text_marked": false, "order_marked": false}}