{"index": 422, "width": 1500, "height": 2122, "dpi": 144.0, "blocks": [], "raw": null, "meta": {"случай": "b7a645e0", "книга": "annopage", "файл": "b7a645e0-aafe-11e4-9a04-5ef3fc9bb22f.jpg", "объектов вне замера": {"спорно": 0, "невыразимо": 1}, "вне замера": [{"box": [56.8, 881.9, 158.8, 984.8], "категория": "Initial", "разряд": "невыразимо"}], "текст размечен": false, "порядок размечен": false}}